full_text,case_folding CPMK2,preprocessing CPMK3
@txtdrimedia @DPR_RI Karena mafia ini pemerintah selalu subsidi BBM yang diimpor dari luar. Kenapa Indonesia gak bikin aja puluhan kilang minyak baru? dan tangkap juga para mafia pembakar kilang minyak. Itu jelas-jelas permainan kotor biar impor BBM tetap jalan terus!,@txtdrimedia @dpr_ri karena mafia ini pemerintah selalu subsidi bbm yang diimpor dari luar. kenapa indonesia gak bikin aja puluhan kilang minyak baru? dan tangkap juga para mafia pembakar kilang minyak. itu jelas-jelas permainan kotor biar impor bbm tetap jalan terus!,mafia perintah subsidi bbm impor indonesia gak bikin aja puluh kilang minyak tangkap mafia bakar kilang minyak main kotor biar impor bbm jalan
@KangManto123 @pertamina Bgmn gk meledak redines tinggi tp sengaja g dipakai utk ngolah krn klo ngolah semua PTM gbisa impor BBM.shrsnya g impor BBM (kualitas jelek) tp dilakukan impor BBM dg mengurangi readiness kilang otomatis kilang ttp beroperasi tanpa minyak mentah krn kuota diambil impor BBM,@kangmanto123 @pertamina bgmn gk meledak redines tinggi tp sengaja g dipakai utk ngolah krn klo ngolah semua ptm gbisa impor bbm.shrsnya g impor bbm (kualitas jelek) tp dilakukan impor bbm dg mengurangi readiness kilang otomatis kilang ttp beroperasi tanpa minyak mentah krn kuota diambil impor bbm,bgmn gk ledak redines tp sengaja g pakai utk ngolah krn klo ngolah ptm gbisa impor bbm shrsnya g impor bbm kualitas jelek tp impor bbm dg kurang readiness kilang otomatis kilang ttp operasi minyak mentah krn kuota ambil impor bbm
@txtdrimedia @DPR_RI Coba DPR-RI tantang Pertamina Buka Kilang minyak baru. Biar gak impor minyak terus. Aneh bin ajaib nih Negara. Tangkapin juga semua mafia migas yang bikin negara kita terus berada di posisi negara berkembang. Mafia para pengihianat yang gak mau negaranya maju.,@txtdrimedia @dpr_ri coba dpr-ri tantang pertamina buka kilang minyak baru. biar gak impor minyak terus. aneh bin ajaib nih negara. tangkapin juga semua mafia migas yang bikin negara kita terus berada di posisi negara berkembang. mafia para pengihianat yang gak mau negaranya maju.,coba dpr ri tantang pertamina buka kilang minyak biar gak impor minyak aneh bin ajaib nih negara tangkapin mafia migas bikin negara posisi negara kembang mafia pengihianat gak negara maju
@P3gEl Yg harus dipikirkan jika mau bangun kilang adalah crude-nya dari mana? Artinya kita harus impor crude. Pikirkan juga apakah lebih baik membangun bbrp kilang gede atau kilang2 mini yg banyak? Tapi perlu dipertimbangkan lebih baik membangun kilang atau memperbanyak stock (tanki)?,@p3gel yg harus dipikirkan jika mau bangun kilang adalah crude-nya dari mana? artinya kita harus impor crude. pikirkan juga apakah lebih baik membangun bbrp kilang gede atau kilang2 mini yg banyak? tapi perlu dipertimbangkan lebih baik membangun kilang atau memperbanyak stock (tanki)?,yg pikir bangun kilang crude nya impor crude pikir bangun bbrp kilang gede kilang mini yg timbang bangun kilang banyak stock tank
Pertamina males2an sengaja tak mau bangun kilang.... https://t.co/eOigyVPv2t,pertamina males2an sengaja tak mau bangun kilang.... https://t.co/eoigyvpv2t,pertamina males an sengaja bangun kilang
@prabowo @pertamina @ditjenbun @DPR_RI LEGACY PRESIDEN KE-8 KEBERLANJUTAN YANG TIDAK TERPUTUS KILANG DIBANGUN DAERAH TIMUR SUPAYA MEN-TRIGGER EKOSISTEM DISANA BERTUMBUH &amp; SEJAHTERA. org2 d @pertamina paham menginterpretasikan data yang sama dalam jangka panjang,@prabowo @pertamina @ditjenbun @dpr_ri legacy presiden ke-8 keberlanjutan yang tidak terputus kilang dibangun daerah timur supaya men-trigger ekosistem disana bertumbuh &amp; sejahtera. org2 d @pertamina paham menginterpretasikan data yang sama dalam jangka panjang,legacy presiden lanjut putus kilang bangun daerah timur men trigger ekosistem sana tumbuh amp sejahtera org d paham interpretasi data jangka
@P3gEl Lah kocaknya kan ijin Shell ngak dikasih kecdaerah terpencil kyk papua . Shell mau aja Asal ada ijin import dan bangun kilang di papua.,@p3gel lah kocaknya kan ijin shell ngak dikasih kecdaerah terpencil kyk papua . shell mau aja asal ada ijin import dan bangun kilang di papua.,kocak ijin shell ngak kasih kecdaerah pencil kyk papua shell aja ijin import bangun kilang papua
iso gak seh linkedin iki dadi tempat nyari loker ae gausah gawe i'm happy to announce... i'm happy to announce gue ga peduli anjeng mau kamu happy to announce kena ledakan kilang pertamina juga gue ga peduli bgst,iso gak seh linkedin iki dadi tempat nyari loker ae gausah gawe i'm happy to announce... i'm happy to announce gue ga peduli anjeng mau kamu happy to announce kena ledakan kilang pertamina juga gue ga peduli bgst,iso gak seh linkedin iki dadi nyari loker ae gausah gawe i m happy to announce i m happy to announce gue ga peduli anjeng happy to announce kena ledak kilang pertamina gue ga peduli bgst
@prabowo @pertamina @ditjenbun @DPR_RI JGN PAKSAKAN KILANG DIBUAT &amp; JGN TRIMA TAWARAN GRATIS BIKIN KILANG JIKA EKOSISTEM PENUNJANG BELUM SIAP JIKA DILAKUKAN SEKARANG EFEKTIF 10-15 TAHUN KEDEPAN TAPI MENYERAP BANYAK TENAGA KERJA DARI SEKARANG. MENINGKATKAN RASIO PENDAPATAN NEGARA TANPA MENINGKATKAN RASIO PAJAK.,@prabowo @pertamina @ditjenbun @dpr_ri jgn paksakan kilang dibuat &amp; jgn trima tawaran gratis bikin kilang jika ekosistem penunjang belum siap jika dilakukan sekarang efektif 10-15 tahun kedepan tapi menyerap banyak tenaga kerja dari sekarang. meningkatkan rasio pendapatan negara tanpa meningkatkan rasio pajak.,jgn paksa kilang amp jgn trima tawar gratis bikin kilang ekosistem tunjang efektif depan serap tenaga kerja tingkat rasio dapat negara tingkat rasio pajak
@somexthread Ferdinand bloon.. Dia terlalu banyak meremehkan Purbaya Jngan lupa pak Pur ini lulusan ITB dan di ITB ada fakultas teknik perminyakan haqqul yakin sesama ITB akan saling support data apalagi data pembaruan kilang minyak tentu pak Pur akan hunting data2 tsb dr ex ITB,@somexthread ferdinand bloon.. dia terlalu banyak meremehkan purbaya jngan lupa pak pur ini lulusan itb dan di itb ada fakultas teknik perminyakan haqqul yakin sesama itb akan saling support data apalagi data pembaruan kilang minyak tentu pak pur akan hunting data2 tsb dr ex itb,ferdinand bloon remeh purbaya jngan lupa pur lulus itb itb fakultas teknik minyak haqqul itb support data data baru kilang minyak pur hunting data tsb dr ex itb
@somexthread Iye politik korupsi jd terganggu kalo ada kilang minyak sendiri,@somexthread iye politik korupsi jd terganggu kalo ada kilang minyak sendiri,iye politik korupsi jd ganggu kalo kilang minyak
@somexthread Emang malas kan bikin kilang minyak. Jgn sok bijak lu kumis bahlul,@somexthread emang malas kan bikin kilang minyak. jgn sok bijak lu kumis bahlul,emang malas bikin kilang minyak jgn sok bijak lu kumis bahlul
@KangManto123 @pertamina Modus lama jika Pertamina di sorot tdk efisien dan lebih sering impor maka.kilang terbakar sebagai alasan tetap butuh impor.....,@kangmanto123 @pertamina modus lama jika pertamina di sorot tdk efisien dan lebih sering impor maka.kilang terbakar sebagai alasan tetap butuh impor.....,modus pertamina sorot tdk efisien impor kilang bakar alas butuh impor
@somexthread Statement politisi kok tdk substantif ? Tdk mampu bangun argumen bahkan sekelas warung kopi pun tdk mampu Kenapa tdk membahas benarkah Pertamina malas bangun kilang? Bandingkan dengan Petronas Aramco dll? Rakyat rugi gaji anda bro ,@somexthread statement politisi kok tdk substantif ? tdk mampu bangun argumen bahkan sekelas warung kopi pun tdk mampu kenapa tdk membahas benarkah pertamina malas bangun kilang? bandingkan dengan petronas aramco dll? rakyat rugi gaji anda bro ,statement politis tdk substantif tdk bangun argumen kelas warung kopi tdk tdk bahas pertamina malas bangun kilang banding petronas aramco rakyat rugi gaji bro
06/10/2025 : JKR Kuala Langat melalui konsesi Roadcare telah menjalankan kerja Memotong Rumput (R03) di Laluan FT0005 Jalan Sepang - Klang Seksyen 396.00 Landmark Kawasan di Kilang Kopi. #IAMJKR #KITAJKRSELANGOR #KITACEKAP @moworksmy @IPJKR_Official @JKRSelangor https://t.co/EOo38hVQeF,06/10/2025 : jkr kuala langat melalui konsesi roadcare telah menjalankan kerja memotong rumput (r03) di laluan ft0005 jalan sepang - klang seksyen 396.00 landmark kawasan di kilang kopi. #iamjkr #kitajkrselangor #kitacekap @moworksmy @ipjkr_official @jkrselangor https://t.co/eoo38hvqef,jkr kuala langat konsesi roadcare jalan kerja potong rumput r lalu ft jalan sepang klang seksyen landmark kawasan kilang kopi iamjkr kitajkrselangor kitacekap
En. Mohamad Ashraf Md Radzi Ketua Eksekutif LTAT hari ini turut hadir bersama YB Dato Seri Mohamed Khaled Nordin Menteri Pertahanan Malaysia dalam lawatan kerja ke Ladang dan Kilang Sawit Nak milik Boustead Plantations Berhad ( BPlant ) di Sandakan Sabah. https://t.co/qMG06JADTd,en. mohamad ashraf md radzi ketua eksekutif ltat hari ini turut hadir bersama yb dato seri mohamed khaled nordin menteri pertahanan malaysia dalam lawatan kerja ke ladang dan kilang sawit nak milik boustead plantations berhad ( bplant ) di sandakan sabah. https://t.co/qmg06jadtd,en mohamad ashraf md radzi ketua eksekutif ltat hadir yb dato seri mohamed khaled nordin menteri tahan malaysia lawat kerja ladang kilang sawit nak milik boustead plantations had bplant sanda sabah
@txtdrimedia Lha...Makanya dia jadi swasta.. kan emang mau untung... ngomong begini harusnya kepertamina noh yg baru ditekan dikit udah bakar2 kilang...,@txtdrimedia lha...makanya dia jadi swasta.. kan emang mau untung... ngomong begini harusnya kepertamina noh yg baru ditekan dikit udah bakar2 kilang...,lha swasta emang untung ngomong kepertamina noh yg tekan dikit udah bakar kilang
@antaranews Cikal bakal Petral yang Mengakar jadi Patra Niaga hingga Pertamina tak mau bangun Kilang baru dan selalu bakar yang ada @KPK_RI @OmbudsmanRI137 @KejaksaanRI @PolkamRI @CNNIndonesia,@antaranews cikal bakal petral yang mengakar jadi patra niaga hingga pertamina tak mau bangun kilang baru dan selalu bakar yang ada @kpk_ri @ombudsmanri137 @kejaksaanri @polkamri @cnnindonesia,cikal petral akar patra niaga pertamina bangun kilang bakar
@are_inismyname @MyPertaminaID @Bambangmulyonoo @BANGSAygSUJUD @bengkeldodo @DedynurPalakka @djalanjoeang08 @drReUtari08 @FDonghun @florieliciouss @Ndons_Back @Kimberley_PS08 Udah gini ga mau investor china cari investor dari negara lain yg mau bangun kilang 30tahun jd milik Indonesia,@are_inismyname @mypertaminaid @bambangmulyonoo @bangsaygsujud @bengkeldodo @dedynurpalakka @djalanjoeang08 @drreutari08 @fdonghun @florieliciouss @ndons_back @kimberley_ps08 udah gini ga mau investor china cari investor dari negara lain yg mau bangun kilang 30tahun jd milik indonesia,udah gin ga investor china cari investor negara yg bangun kilang jd milik indonesia
akubpenasaran algoritma tiktok yg 5 hatian lalu soal kilang minyak sekarang malah ketutup sama kasus bjorka sih. pengalihan isu kah ini?,akubpenasaran algoritma tiktok yg 5 hatian lalu soal kilang minyak sekarang malah ketutup sama kasus bjorka sih. pengalihan isu kah ini?,akubpenasaran algoritma tiktok yg hati kilang minyak tutup bjorka sih alih isu
@M45Broo_ Punya walopun belom selesai pasti terendus oleh wartawan ato netizen yg naluri berburu beritanya tajam tapi ini gk kedengeran kabar. Masa iya sekelas menkeu ketinggalan berita padahal menkeu skrg juga pejabat negara sebelumnya gak tau pertamina punya calon kilang,@m45broo_ punya walopun belom selesai pasti terendus oleh wartawan ato netizen yg naluri berburu beritanya tajam tapi ini gk kedengeran kabar. masa iya sekelas menkeu ketinggalan berita padahal menkeu skrg juga pejabat negara sebelumnya gak tau pertamina punya calon kilang,walopun bom selesai endus wartawan ato netizen yg naluri buru berita tajam gk kedengeran kabar iya kelas menkeu tinggal berita menkeu skrg jabat negara gak tau pertamina calon kilang
@P3gEl Pertamina jual BBM tdk ada saingan tp boncos melulu Pejabatnya Gaji Tunjangan maunya segede gaban mending Pertamina dibubarkan Negara kerjasama aja dgn Petronas harga lebih murah gak repot gak ada kilang minyak kebakaran gak ada pengoplosan BBM,@p3gel pertamina jual bbm tdk ada saingan tp boncos melulu pejabatnya gaji tunjangan maunya segede gaban mending pertamina dibubarkan negara kerjasama aja dgn petronas harga lebih murah gak repot gak ada kilang minyak kebakaran gak ada pengoplosan bbm,pertamina jual bbm tdk saing tp boncos melulu jabat gaji tunjang mau gede gaban mending pertamina bubar negara kerjasama aja dgn petronas harga murah gak repot gak kilang minyak bakar gak oplos bbm
Iya dong. Jangan pake takut kualat. Selidiki juga semua kebakaran kilang minyak Pertamina yang selama ini terjadi. Siapa yang musti masuk penjara?,iya dong. jangan pake takut kualat. selidiki juga semua kebakaran kilang minyak pertamina yang selama ini terjadi. siapa yang musti masuk penjara?,iya pake takut kualat selidik bakar kilang minyak pertamina musti masuk penjara
@drrizqie Ada satu info simpang siur ini masalah mafia Ada beberapa kilang independen yg ada di SG/ID itu punya pejabat yg mana Pertamina simpan raw oil/gas disana secara sewa Jadi (sebagian teks hilang),@drrizqie ada satu info simpang siur ini masalah mafia ada beberapa kilang independen yg ada di sg/id itu punya pejabat yg mana pertamina simpan raw oil/gas disana secara sewa jadi (sebagian teks hilang),info simpang siur mafia kilang independen yg sg id jabat yg pertamina simpan raw oil gas sana sewa teks hilang
Mungkin usia kilang-kilang minyak Pertamina sudah tua dan juga kurang pemeliharaan atau perawatan sehingga sering terjadi kebakaran.,mungkin usia kilang-kilang minyak pertamina sudah tua dan juga kurang pemeliharaan atau perawatan sehingga sering terjadi kebakaran.,usia kilang kilang minyak pertamina tua pelihara awat bakar
@Bhaktismail @tekarok007 Dan apesnya lagi setelah kerajaan saudi membatalkan inves di indo dan di gantikan oleh rosneft rusia dan bagun kilang minyak di tuban yang rencanya bisa produkai menyuling 300rb bph /day malah mendapat kendala gara rusia ke sangsi amerika akibat nyaplok ukr.,@bhaktismail @tekarok007 dan apesnya lagi setelah kerajaan saudi membatalkan inves di indo dan di gantikan oleh rosneft rusia dan bagun kilang minyak di tuban yang rencanya bisa produkai menyuling 300rb bph /day malah mendapat kendala gara rusia ke sangsi amerika akibat nyaplok ukr.,apes raja saudi batal inves indo ganti rosneft rusia bagun kilang minyak tuban rencanya produkai suling rb bph day kendala gara rusia sangsi amerika akibat nyaplok ukr
@KangManto123 @pertamina musibah loh siapa yang tau dan siapa yang mau Pertamina jg pasti sudah menerapkan sop dan keamanan di setiap kilang kecelakaan kerja itu hal yang bisa terjadi di dunia kerja tapi terlepas dr itu kedepannya ini pasti jadi pelajaran juga supaya kedepannya lebih savety,@kangmanto123 @pertamina musibah loh siapa yang tau dan siapa yang mau pertamina jg pasti sudah menerapkan sop dan keamanan di setiap kilang kecelakaan kerja itu hal yang bisa terjadi di dunia kerja tapi terlepas dr itu kedepannya ini pasti jadi pelajaran juga supaya kedepannya lebih savety,musibah loh tau pertamina jg terap sop aman kilang celaka kerja dunia kerja lepas dr depan ajar depan savety
@Trevormay456 @r_khoirilanam @aktiviskatak @txtdrimedia Lah kilang pertamina aja pada dibakar tau kan kenapa bbm langka dan impor terus,@trevormay456 @r_khoirilanam @aktiviskatak @txtdrimedia lah kilang pertamina aja pada dibakar tau kan kenapa bbm langka dan impor terus,kilang pertamina aja bakar tau bbm langka impor
@arwidodo Dugaan : Kandungan minyak di Indonesia banyak tp minyak mentah nya di jual ke Singapura setelah di proses jadi BBM dr Singapura lalu dibeli lg oleh calo minyak yg ada di pertamina Pantesan mrk gak mau bangun kilang ternyata SDM nya cuma sekelas calo Negara dipaksa menggaji calo,@arwidodo dugaan : kandungan minyak di indonesia banyak tp minyak mentah nya di jual ke singapura setelah di proses jadi bbm dr singapura lalu dibeli lg oleh calo minyak yg ada di pertamina pantesan mrk gak mau bangun kilang ternyata sdm nya cuma sekelas calo negara dipaksa menggaji calo,duga kandung minyak indonesia tp minyak mentah nya jual singapura proses bbm dr singapura beli lg calo minyak yg pertamina pantesan mrk gak bangun kilang sdm nya kelas calo negara paksa gaji calo
@kompascom Yg nyebarin hoax kebakaran kilang itu dia mendewakan purbaya lard lord lard lord apaan dah ,@kompascom yg nyebarin hoax kebakaran kilang itu dia mendewakan purbaya lard lord lard lord apaan dah ,yg nyebarin hoax bakar kilang dewa purbaya lard lord lard lord dah
@atasanpresidenr Emang Indonesia punya kilang minyak terakhir masih jadi lumpur yang bikin satu kecamatan tengelam lumpur dan saat ini masih terus berlanjut sampai belum tersalurkan pergantian nya karena negara sulit soalnya ,@atasanpresidenr emang indonesia punya kilang minyak terakhir masih jadi lumpur yang bikin satu kecamatan tengelam lumpur dan saat ini masih terus berlanjut sampai belum tersalurkan pergantian nya karena negara sulit soalnya ,emang indonesia kilang minyak lumpur bikin camat tengelam lumpur lanjut salur ganti nya negara sulit
@P3gEl Cie cie.. Framing busuk buat Pertamina supaya bangkrut kayak Garuda. Kalau Petro Chinese bangun kilang selama 30 Thn akan berapa banyak hasil bumi yang diambil? Setelah 30 thn apakah kilang masih bekerja dengan baik atau malah sdh jadi rongsok dgn biaya maintenance tinggi?,@p3gel cie cie.. framing busuk buat pertamina supaya bangkrut kayak garuda. kalau petro chinese bangun kilang selama 30 thn akan berapa banyak hasil bumi yang diambil? setelah 30 thn apakah kilang masih bekerja dengan baik atau malah sdh jadi rongsok dgn biaya maintenance tinggi?,cie cie framing busuk pertamina bangkrut kayak garuda petro chinese bangun kilang thn hasil bumi ambil thn kilang sdh rongsok dgn biaya maintenance
@kegblgnunfaedh Ebeg kimcil kilang minyak kerupuk tengiri mendoan,@kegblgnunfaedh ebeg kimcil kilang minyak kerupuk tengiri mendoan,ebeg kimcil kilang minyak kerupuk tengiri mendoan
@KangManto123 @pertamina Cilacap sering bangettt pernah dulu magang di cilacap pas kilang kebakar padahal kosan jauh dari kilang tapi berasa panas bgt ya tuhannn,@kangmanto123 @pertamina cilacap sering bangettt pernah dulu magang di cilacap pas kilang kebakar padahal kosan jauh dari kilang tapi berasa panas bgt ya tuhannn,cilacap banget magang cilacap pas kilang bakar kosan kilang asa panas bgt tuhan
Yg lebih konyol selama puluhan tahun gak ada kilang baru yang benerÂ² jadi. Alasannya klasik : dana birokrasi dan izin Tuhan yang diselipin di balik meja pejabat. Padahal rakyat tiap hari beli bensin dengan harga yang ngeluh di dompet.,yg lebih konyol selama puluhan tahun gak ada kilang baru yang benerÂ² jadi. alasannya klasik : dana birokrasi dan izin tuhan yang diselipin di balik meja pejabat. padahal rakyat tiap hari beli bensin dengan harga yang ngeluh di dompet.,yg konyol puluh gak kilang bener alas klasik dana birokrasi izin tuhan diselipin meja jabat rakyat beli bensin harga ngeluh dompet
@pertamina BAKAAAR AE TERUS KILANG NYEE,@pertamina bakaaar ae terus kilang nyee,bakar ae kilang nyee
@Psalm2000 @M45Broo_ Ya benar. Pertamina sedang membangun dan meningkatkan kilang minyak di Indonesia seperti upgrade Balikpapan yang sudah 96 5% selesai (akan operasional 2025). Ada juga rencana 17 kilang modular dengan dukungan AS. Pernyataan sudah punya tapi belum selesai mencerminkan proyek,@psalm2000 @m45broo_ ya benar. pertamina sedang membangun dan meningkatkan kilang minyak di indonesia seperti upgrade balikpapan yang sudah 96 5% selesai (akan operasional 2025). ada juga rencana 17 kilang modular dengan dukungan as. pernyataan sudah punya tapi belum selesai mencerminkan proyek,pertamina bangun tingkat kilang minyak indonesia upgrade balikpapan selesai operasional rencana kilang modular dukung as nyata selesai cermin proyek
@M45Broo_ Hi @grok Apakah benar yang dikatakan Pertamina bahwa negara ini sedang membangun kilang minyak ?? Bahasa mereka memang sungguh bahasa Mulyono yg ijazahnya meragukan dan membagongkan .mereka bilang sudah punya killang tapi belum selesai,@m45broo_ hi @grok apakah benar yang dikatakan pertamina bahwa negara ini sedang membangun kilang minyak ?? bahasa mereka memang sungguh bahasa mulyono yg ijazahnya meragukan dan membagongkan .mereka bilang sudah punya killang tapi belum selesai,hi pertamina negara bangun kilang minyak bahasa sungguh bahasa mulyono yg ijazah ragu bagong bilang killang selesai
@somexthread Jawablah bos dg analisa mengapa kilang menghilang karena import BBM lebih menjanjikan cuan ya baik harga mutu jumlah hilang dlm proses dan oplosannya triyunan aman tidak kentara.,@somexthread jawablah bos dg analisa mengapa kilang menghilang karena import bbm lebih menjanjikan cuan ya baik harga mutu jumlah hilang dlm proses dan oplosannya triyunan aman tidak kentara.,jawab bos dg analisa kilang hilang import bbm janji cuan harga mutu hilang dlm proses oplos triyunan aman kentara
Lah ini anggota DPR ga baca berita apa? Shell tuh mau cabut dr pasar Indo Pak/Bu.... Lah kilang minyak nya aja yang di Singapore dah dibeli sama perusahaan Indonesia tahun ini ,lah ini anggota dpr ga baca berita apa? shell tuh mau cabut dr pasar indo pak/bu.... lah kilang minyak nya aja yang di singapore dah dibeli sama perusahaan indonesia tahun ini ,anggota dpr ga baca berita shell tuh cabut dr pasar indo bu kilang minyak nya aja singapore dah beli usaha indonesia
@tekarok007 Dan sekarang kilang minyak hasil kerja sama aramco dan petronas sudah beroperasi fulll dan menghasilkan minyak degan kualitas euro 5. Tidak heran jika malaysia jual solar degan kualitas euro 5 harganya murah meriah. Kita euro 5 masih banyak impor dari singapure.,@tekarok007 dan sekarang kilang minyak hasil kerja sama aramco dan petronas sudah beroperasi fulll dan menghasilkan minyak degan kualitas euro 5. tidak heran jika malaysia jual solar degan kualitas euro 5 harganya murah meriah. kita euro 5 masih banyak impor dari singapure.,kilang minyak hasil kerja aramco petronas operasi ful hasil minyak degan kualitas euro heran malaysia jual solar degan kualitas euro harga murah riah euro impor singapure
@tekarok007 Yang paling nyesek itu ketika indonesia di tinggal aramco saudi arabia untuk bagun kilang minyak di indonesia degan kapasitas 500000bph-10000000bph /day degan kualitas euro 5. Dan kerajaan arab saudi memilih bagun kilang di pengerang johor malaysia. Dan proyek itu selesai 2018,@tekarok007 yang paling nyesek itu ketika indonesia di tinggal aramco saudi arabia untuk bagun kilang minyak di indonesia degan kapasitas 500000bph-10000000bph /day degan kualitas euro 5. dan kerajaan arab saudi memilih bagun kilang di pengerang johor malaysia. dan proyek itu selesai 2018,nyesek indonesia tinggal aramco saudi arabia bagun kilang minyak indonesia degan kapasitas bph bph day degan kualitas euro raja arab saudi pilih bagun kilang erang johor malaysia proyek selesai
@KangManto123 Solusi: Ganti inovasi ganti sistem pemerintah dan ekonomi.... Bangun sumur bangun pengeboran Bangun biorefinery bangun kilang minyak modern BONUS: Pasar dimodernisasi infra jalan dimodernisasi,@kangmanto123 solusi: ganti inovasi ganti sistem pemerintah dan ekonomi.... bangun sumur bangun pengeboran bangun biorefinery bangun kilang minyak modern bonus: pasar dimodernisasi infra jalan dimodernisasi,solusi ganti inovasi ganti sistem perintah ekonomi bangun sumur bangun bor bangun biorefinery bangun kilang minyak modern bonus pasar modernisasi infra jalan modernisasi
@ARSIPAJA Ada yg tidak mau bangun kilang baru karena merugikan kantong sendiri ,@arsipaja ada yg tidak mau bangun kilang baru karena merugikan kantong sendiri ,yg bangun kilang rugi kantong
@puppypopiah Aku kebalikan kamu beb mukaku oily kek kilang minyak pake apa yaaa,@puppypopiah aku kebalikan kamu beb mukaku oily kek kilang minyak pake apa yaaa,balik beb muka oily kek kilang minyak pake
@ARSIPAJA si tolol kirain abia di demo bakalan lebih mikir kalo ngomomg eh tolol jelas swasta itu bikin usaha buat nyari untung elu aja kaga kerja masih nuntut naek tunjangan? lah lawak lu suruh tuh pertamina bangaun kilang minyak dasar tolol abis di demo bukannya mikir malah tolol,@arsipaja si tolol kirain abia di demo bakalan lebih mikir kalo ngomomg eh tolol jelas swasta itu bikin usaha buat nyari untung elu aja kaga kerja masih nuntut naek tunjangan? lah lawak lu suruh tuh pertamina bangaun kilang minyak dasar tolol abis di demo bukannya mikir malah tolol,si tolol kirain abia demo mikir kalo ngomomg eh tolol swasta bikin usaha nyari untung elu aja kaga kerja nuntut naek tunjang lawak lu suruh tuh pertamina bangaun kilang minyak dasar tolol abis demo mikir tolol
@Twittysweetie_ malah bikin kilang berkurang karena harus perbaikan yah.,@twittysweetie_ malah bikin kilang berkurang karena harus perbaikan yah.,bikin kilang kurang baik yah
Presiden RI ke 7 Jokowi dari dulu udah perintahkan bangun kilang tapi tidak dilaksanakan oleh Pertamina sampai detik ini.Jadi siapa aslinya pemimpin Pertamina itu? Sampai berani hiraukan perintah Presiden?,presiden ri ke 7 jokowi dari dulu udah perintahkan bangun kilang tapi tidak dilaksanakan oleh pertamina sampai detik ini.jadi siapa aslinya pemimpin pertamina itu? sampai berani hiraukan perintah presiden?,presiden ri jokowi udah perintah bangun kilang laksana pertamina detik asli pimpin pertamina berani hirau perintah presiden
sambil menuding Purbaya salah membaca data. Simak selengkapnya: https://t.co/XHDXtYbR4I https://t.co/bXioIp4DrO,sambil menuding purbaya salah membaca data. simak selengkapnya: https://t.co/xhdxtybr4i https://t.co/bxioip4dro,tuding purbaya salah baca data simak lengkap
