full_text,case_folding CPMK2,preprocessing CPMK3
Langkah besar RDMP Balikpapan Pertamina ungkap proyek siap lakukan uji operasi RFCC tonggak penting menuju peningkatan kapasitas kilang nasional. https://t.co/WalQSTkjh0,langkah besar rdmp balikpapan pertamina ungkap proyek siap lakukan uji operasi rfcc tonggak penting menuju peningkatan kapasitas kilang nasional. https://t.co/walqstkjh0,langkah rdmp balikpapan pertamina proyek laku uji operasi rfcc tonggak tingkat kapasitas kilang nasional
jadi ini alasan battlepass dota diilangin prizepool TI bisa kilang minyak nanti,jadi ini alasan battlepass dota diilangin prizepool ti bisa kilang minyak nanti,alas battlepass dota diilangin prizepool ti kilang minyak
Telat banget baru tau kilang pertamina dumai meledak semalem https://t.co/cNx3YPemH8,telat banget baru tau kilang pertamina dumai meledak semalem https://t.co/cnx3ypemh8,telat banget tau kilang pertamina dumai ledak semalem
@mr_wayan @kejadian_today Kejadian kebakaran kilang minyak terjadi di seluruh dunia bukan hanya di Indonesia. Di Indonesia ada 36 insiden sektor migas 2008-2023 termasuk kebakaran berulang di Pertamina seperti Dumai (kedua kalinya). Secara global AS catat beberapa kebakaran di 2025 (misalnya Valero,@mr_wayan @kejadian_today kejadian kebakaran kilang minyak terjadi di seluruh dunia bukan hanya di indonesia. di indonesia ada 36 insiden sektor migas 2008-2023 termasuk kebakaran berulang di pertamina seperti dumai (kedua kalinya). secara global as catat beberapa kebakaran di 2025 (misalnya valero,jadi bakar kilang minyak dunia indonesia indonesia insiden sektor migas bakar ulang pertamina dumai kali global as catat bakar valero
@kejadian_today @grok bandingkan kejadian kilang terbakar di Indonesia dgn negara lain apakah wajar kejadian kilang terbakar di indonesia? Berdasarkan penyelidikan kebakaran sebelumnya jelaskan penyebab umumnya,@kejadian_today @grok bandingkan kejadian kilang terbakar di indonesia dgn negara lain apakah wajar kejadian kilang terbakar di indonesia? berdasarkan penyelidikan kebakaran sebelumnya jelaskan penyebab umumnya,banding jadi kilang bakar indonesia dgn negara wajar jadi kilang bakar indonesia dasar lidi bakar sebab
@Mdy_Asmara1701 Pertamina bukan males tapi kalo dibangun kilang di Indonesia Pertamina nggak akan dapat celah lagi untuk korupsi,@mdy_asmara1701 pertamina bukan males tapi kalo dibangun kilang di indonesia pertamina nggak akan dapat celah lagi untuk korupsi,pertamina males kalo bangun kilang indonesia pertamina celah korupsi
Mana ada meledak sengaja dibakar iya..sesuai pernyataan Menkeu Pertamina suruh bangun kilang baru biar gak terlalu byk impor dari Singapore eh gak pernah dikerjain yg sudah ada malah dibakar kenapa ? Karena Mafia2 yg ada di Pertamina gak bisa nyolong klo bangun kilang baru.,mana ada meledak sengaja dibakar iya..sesuai pernyataan menkeu pertamina suruh bangun kilang baru biar gak terlalu byk impor dari singapore eh gak pernah dikerjain yg sudah ada malah dibakar kenapa ? karena mafia2 yg ada di pertamina gak bisa nyolong klo bangun kilang baru.,ledak sengaja bakar iya sesuai nyata menkeu pertamina suruh bangun kilang biar gak byk impor singapore eh gak dikerjain yg bakar mafia yg pertamina gak nyolong klo bangun kilang
like pemikiran kuu ternyata ga salahh emg sengaja dibakarr karna mereka yg kerja anteng bae haha pantess kokk yo rame pol manusia di luar pager nyaa masyarakat yg tinggal deket kilang juga kek santai ajaa soale temenku deket kilang rumahnyaa GADA GUNANYA YG KU TAKUTKAN JNCK,like pemikiran kuu ternyata ga salahh emg sengaja dibakarr karna mereka yg kerja anteng bae haha pantess kokk yo rame pol manusia di luar pager nyaa masyarakat yg tinggal deket kilang juga kek santai ajaa soale temenku deket kilang rumahnyaa gada gunanya yg ku takutkan jnck,like pikir kuu ga salahh emg sengaja dibakarr karna yg kerja anteng bae haha pantess kokk yo rame pol manusia pager nyaa masyarakat yg tinggal deket kilang kek santai ajaa soale temenku deket kilang rumahnyaa gada guna yg ku takut jnck
*Menkeu Purbaya Pernah Minta Pertamina Bikin 7 Kilang Baru Bukan Justru Dibakar. Saat dirinya masih bertugas di Kementerian Koordinator Bidang Maritim dan Investasi ia telah merekomendasikan Pertamina untuk membangun tujuh kilang baru dalam lima tahu https://t.co/YW1bBVHE6V https://t.co/WeDLlLImSc,*menkeu purbaya pernah minta pertamina bikin 7 kilang baru bukan justru dibakar. saat dirinya masih bertugas di kementerian koordinator bidang maritim dan investasi ia telah merekomendasikan pertamina untuk membangun tujuh kilang baru dalam lima tahu https://t.co/yw1bbvhe6v https://t.co/wedlllimsc,menkeu purbaya pertamina bikin kilang bakar tugas menteri koordinator bidang maritim investasi rekomendasi pertamina bangun tujuh kilang
*Bakar Semangat Bukan Bakar Kilang Minyak: Melawan Gurita Mafia Migas yang Semakin Merajalela* Oleh: Andre Vincent Wenas https://t.co/RL2GyvP1Ud,*bakar semangat bukan bakar kilang minyak: melawan gurita mafia migas yang semakin merajalela* oleh: andre vincent wenas https://t.co/rl2gyvp1ud,bakar semangat bakar kilang minyak lawan gurita mafia migas rajalela andre vincent wenas
[VIDEO] Kali Kedua! Kilang Minyak Milik Pertamina di Dumai Meledak &amp; Terbakar Kilang minyak Dumai milik Pertamina kembali mengalami kebakaran pada Rabu (1/10/2025) malam. #SPPGPolri https://t.co/BdQZG1225Z,[video] kali kedua! kilang minyak milik pertamina di dumai meledak &amp; terbakar kilang minyak dumai milik pertamina kembali mengalami kebakaran pada rabu (1/10/2025) malam. #sppgpolri https://t.co/bdqzg1225z,video kali kilang minyak milik pertamina dumai ledak amp bakar kilang minyak dumai milik pertamina alami bakar rabu malam sppgpolri
*Bakar Semangat Bukan Bakar Kilang Minyak: Melawan Gurita Mafia Migas yang Semakin Merajalela* Oleh: Andre Vincent Wenas https://t.co/RL2GyvP1Ud,*bakar semangat bukan bakar kilang minyak: melawan gurita mafia migas yang semakin merajalela* oleh: andre vincent wenas https://t.co/rl2gyvp1ud,bakar semangat bakar kilang minyak lawan gurita mafia migas rajalela andre vincent wenas
@taufik_q Inget Pak Menkeu berkata soal kilang minyak.,@taufik_q inget pak menkeu berkata soal kilang minyak.,inget menkeu kilang minyak
@msaid_didu Klo bikin kilang marah dong importirnya?,@msaid_didu klo bikin kilang marah dong importirnya?,klo bikin kilang marah importir
 Oplos mengoplos masih ada ya? Jika ya Dikilang mana ini dilakukan? Ehh... Kan ada kilang yg terbakar ya di Dumai. Kok bisa pas peristiwa nya. Apa gara2 Bahlul? https://t.co/I8u3TN4B2b, oplos mengoplos masih ada ya? jika ya dikilang mana ini dilakukan? ehh... kan ada kilang yg terbakar ya di dumai. kok bisa pas peristiwa nya. apa gara2 bahlul? https://t.co/i8u3tn4b2b,oplos oplos kilang ehh kilang yg bakar dumai pas peristiwa nya gara bahlul
HAHAHAHA Udah biasa itu ga usah kaget pak. Ada temen pernah magang di kilang pertamina katanya ada karyawan organik yg pernah bilang: halah kebakaran di kilang ya wajar mas. Udah sering itu. Jangan kaget ya ,hahahaha udah biasa itu ga usah kaget pak. ada temen pernah magang di kilang pertamina katanya ada karyawan organik yg pernah bilang: halah kebakaran di kilang ya wajar mas. udah sering itu. jangan kaget ya ,hahahaha udah ga kaget temen magang kilang pertamina karyawan organik yg bilang halah bakar kilang wajar mas udah kaget
Kilang Pertamina Dumai meledak. Musibah biasa kebetulan sabotase penghilangan barbuk oplosan entahlah? Kita tunggu saja detailnya.. Btw Semua kelakuan manusia rakus itu aneh2 diluar nalar. https://t.co/C9ATiCMrTR,kilang pertamina dumai meledak. musibah biasa kebetulan sabotase penghilangan barbuk oplosan entahlah? kita tunggu saja detailnya.. btw semua kelakuan manusia rakus itu aneh2 diluar nalar. https://t.co/c9aticmrtr,kilang pertamina dumai ledak musibah sabotase hilang barbuk oplos tunggu detail btw laku manusia rakus aneh luar nalar
KILANG PERTAMINA DUMAI TERBAKAR: WARGA TRAUMA KEJADIAN 2023 #KilangPertaminaDumai #KebakaranKilang #Pertamina #Dumai #EnergiNasional #LedakanKilang #BBM #Sumatera #TraumaWarga #Kebakaran2025 #SNN #SIBNewsNetwork https://t.co/Ze70IiJT8m,kilang pertamina dumai terbakar: warga trauma kejadian 2023 #kilangpertaminadumai #kebakarankilang #pertamina #dumai #energinasional #ledakankilang #bbm #sumatera #traumawarga #kebakaran2025 #snn #sibnewsnetwork https://t.co/ze70iijt8m,kilang pertamina dumai bakar warga trauma jadi kilangpertaminadumai kebakarankilang pertamina dumai energinasional ledakankilang bbm sumatera traumawarga bakar snn sibnewsnetwork
SABOTASE MAFIA MIGAS? DISEBUT MENKEU MALAS BANGUN KILANG EH KILANG PERTAMINA DI DUMAI MALAH TERBAKAR https://t.co/uN9JTCAQty https://t.co/0jTNOx59Ib,sabotase mafia migas? disebut menkeu malas bangun kilang eh kilang pertamina di dumai malah terbakar https://t.co/un9jtcaqty https://t.co/0jtnox59ib,sabotase mafia migas menkeu malas bangun kilang eh kilang pertamina dumai bakar
@RadioElshinta Kata Purbaya kilang minyak dibakar-bakari.,@radioelshinta kata purbaya kilang minyak dibakar-bakari.,purbaya kilang minyak bakar bakar
@urboyf57 @tanyakanrl aku oily dr awal pake yg varian itu aman aja sih kakk minyakannya masih wajar gak bikin makin tambah kilang gituu. kalau ungu iyaa belum ada size besarnya,@urboyf57 @tanyakanrl aku oily dr awal pake yg varian itu aman aja sih kakk minyakannya masih wajar gak bikin makin tambah kilang gituu. kalau ungu iyaa belum ada size besarnya,oily dr pake yg varian aman aja sih kakk minyak wajar gak bikin kilang gituu ungu iyaa size besar
Adakah Kemungkinan para Mafia Minyak Level Tingkat Tinggi Bermain untuk menjatuhkan Pertamina perusahan dalam negeri. EFECK PABRIK KILANG MINYAK ANAKNYA NURDIN DISITA .,adakah kemungkinan para mafia minyak level tingkat tinggi bermain untuk menjatuhkan pertamina perusahan dalam negeri. efeck pabrik kilang minyak anaknya nurdin disita .,ada mafia minyak level tingkat main jatuh pertamina usah negeri efeck pabrik kilang minyak anak nurdin sita
@tempodotco Indon kilang minyak dh tua kapasitas 800.000 barel per hari untuk 240 juta jiwa. kita butuh 1 5 juta barel per hari Malaysia punya kilang minyak saat ini 722.000 barel per hari cukup untuk memenuhi BBM 28 juta.,@tempodotco indon kilang minyak dh tua kapasitas 800.000 barel per hari untuk 240 juta jiwa. kita butuh 1 5 juta barel per hari malaysia punya kilang minyak saat ini 722.000 barel per hari cukup untuk memenuhi bbm 28 juta.,indon kilang minyak dh tua kapasitas barel juta jiwa butuh juta barel malaysia kilang minyak barel penuh bbm juta
Tim ESDM Turun ke Dumai Cek Penyebab Kebakaran Kilang https://t.co/85HMHoZ0yd,tim esdm turun ke dumai cek penyebab kebakaran kilang https://t.co/85hmhoz0yd,tim esdm turun dumai cek sebab bakar kilang
Bakar Semangat Bukan Bakar Kilang Minyak: Melawan Gurita Mafia Migas yang Semakin Merajalela Oleh: Andre Vincent Wenas https://t.co/wuIbq94C8j,bakar semangat bukan bakar kilang minyak: melawan gurita mafia migas yang semakin merajalela oleh: andre vincent wenas https://t.co/wuibq94c8j,bakar semangat bakar kilang minyak lawan gurita mafia migas rajalela andre vincent wenas
Sumpah baru tau kilang kebakaran. Mana abang I nggak bisa dihubungin lagi,sumpah baru tau kilang kebakaran. mana abang i nggak bisa dihubungin lagi,sumpah tau kilang bakar abang i dihubungin
Kritik Purbaya Bergema Insiden Kebakaran Kilang Dumai Pertanyakan Seriusnya Pertamina https://t.co/WjSRC3Rh7W,kritik purbaya bergema insiden kebakaran kilang dumai pertanyakan seriusnya pertamina https://t.co/wjsrc3rh7w,kritik purbaya gema insiden bakar kilang dumai serius pertamina
Kilang Pertamina Dumai Dilanda Ledakan Api Membubung Tinggi ke Langit Malam https://t.co/XOGTkhYGSn,kilang pertamina dumai dilanda ledakan api membubung tinggi ke langit malam https://t.co/xogtkhygsn,kilang pertamina dumai landa ledak api bubung langit malam
KILANG minyak MILIK RAKYAT DIBAKAR oleh PERAMPOK KORUPTOR...HARUS TANGKAP PELAKUNYA rakyat yang mau Maju jangan diam diam seperti KURA KURA BATU BANGKIT DONG JANGAN CUMA MAU UANG SOGOKAN PARTAI PARTAI https://t.co/3mZVYCqn5A,kilang minyak milik rakyat dibakar oleh perampok koruptor...harus tangkap pelakunya rakyat yang mau maju jangan diam diam seperti kura kura batu bangkit dong jangan cuma mau uang sogokan partai partai https://t.co/3mzvycqn5a,kilang minyak milik rakyat bakar rampok koruptor tangkap laku rakyat maju diam diam kura kura batu bangkit uang sogo partai partai
Setelah Disebut Malas Bangun Kilang Pertamina Kembali Hadapi Kebakaran di Dumai https://t.co/1kw1fPat17,setelah disebut malas bangun kilang pertamina kembali hadapi kebakaran di dumai https://t.co/1kw1fpat17,malas bangun kilang pertamina hadap bakar dumai
Kilang Pertamina Dumai Meledak Warga Mengungsi Karena Takut Ledakan Susulan https://t.co/WprQ6iMDgA,kilang pertamina dumai meledak warga mengungsi karena takut ledakan susulan https://t.co/wprq6imdga,kilang pertamina dumai ledak warga ungsi takut ledak susul
@imajinasir @Nicke9662734599 @dhaintly Kalau di perhatikan masa ada kilang minyak kebakar 2 kali.,@imajinasir @nicke9662734599 @dhaintly kalau di perhatikan masa ada kilang minyak kebakar 2 kali.,perhati kilang minyak bakar kali
@RadioElshinta Kilang terbakar setelah swasta gak mau beli? ,@radioelshinta kilang terbakar setelah swasta gak mau beli? ,kilang bakar swasta gak beli
@StefanAntonio__ @prabowo Tapi gimana..apa pula hubungannya dgn kilang yang terbakar? https://t.co/WEACT0ZAD6,@stefanantonio__ @prabowo tapi gimana..apa pula hubungannya dgn kilang yang terbakar? https://t.co/weact0zad6,gimana hubung dgn kilang bakar
Sebut Menkeu Purbaya Keliru CERI: Masalah Indonesia Bukan Kilang Tapi Lifting via @kedaipenacom https://t.co/wFZ8SQEdAw,sebut menkeu purbaya keliru ceri: masalah indonesia bukan kilang tapi lifting via @kedaipenacom https://t.co/wfz8sqedaw,menkeu purbaya keliru ceri indonesia kilang lifting via
Malam Jumaat esok Jumaat meh la cari pahala tolong student isi survey kalau kerja kilang boleh forwardkan dkt kawan2 kilang... Also offer for coaching from me - about work life study ,malam jumaat esok jumaat meh la cari pahala tolong student isi survey kalau kerja kilang boleh forwardkan dkt kawan2 kilang... also offer for coaching from me - about work life study ,malam jumaat esok jumaat meh la cari pahala student isi survey kerja kilang forwardkan dkt kawan kilang also offer for coaching from me about work life study
@yaelahhcin Sini bareng aku ke palembang wkwkwk Tapi doain aku dapet kerja di kilang palembang sih jadi aku pulang bisa sekalian bawain kamu,@yaelahhcin sini bareng aku ke palembang wkwkwk tapi doain aku dapet kerja di kilang palembang sih jadi aku pulang bisa sekalian bawain kamu,bareng palembang wkwkwk doain dapet kerja kilang palembang sih pulang bawain
@Mdy_Asmara1701 Pengalihan isu apa nih? Kilang minyak ter(di)bakar?,@mdy_asmara1701 pengalihan isu apa nih? kilang minyak ter(di)bakar?,alih isu nih kilang minyak ter bakar
@dhaintly Baru juga dibilangin ehhh kejadian lagi ditempat kami Kilang DUMAI https://t.co/2f0ttjicU8,@dhaintly baru juga dibilangin ehhh kejadian lagi ditempat kami kilang dumai https://t.co/2f0ttjicu8,dibilangin eh jadi tempat kilang dumai
@genuinelyask @DramaPerkoreaan @TroissiOto @pertamina @KemenkeuRI @prabowo @gibran_tweet Berdasarkan informasi terkini dari berbagai sumber seperti Argus Media Jakarta Post dan Jakarta Globe kebakaran di Kilang Pertamina Dumai pada 1 Oktober 2025 masih diselidiki penyebabnya. Belum ada bukti sabotase atau pembakaran sengaja. Tidak ada korban jiwa pasokan BBM,@genuinelyask @dramaperkoreaan @troissioto @pertamina @kemenkeuri @prabowo @gibran_tweet berdasarkan informasi terkini dari berbagai sumber seperti argus media jakarta post dan jakarta globe kebakaran di kilang pertamina dumai pada 1 oktober 2025 masih diselidiki penyebabnya. belum ada bukti sabotase atau pembakaran sengaja. tidak ada korban jiwa pasokan bbm,dasar informasi kini sumber argus media jakarta post jakarta globe bakar kilang pertamina dumai oktober selidik sebab bukti sabotase bakar sengaja korban jiwa pasok bbm
@Tamarakhop KALIAN KEPEDEAN SELAT HORMUS .. LAUT MERAH KILANG MINYA .. AKAN MENGGONCANG KALIAN ,@tamarakhop kalian kepedean selat hormus .. laut merah kilang minya .. akan menggoncang kalian ,kepedean selat hormus laut merah kilang mi menggoncang
Omongan Menkeu Purbaya Terbukti? Kilang Pertamina di Dumai Langsung Terbakar! https://t.co/NMV82vUX50,omongan menkeu purbaya terbukti? kilang pertamina di dumai langsung terbakar! https://t.co/nmv82vux50,omong menkeu purbaya bukti kilang pertamina dumai langsung bakar
@sukamtoeska @MrTe9uh @islah_bahrawi Kalau tahu akar penyebabnya itu mengapa tdk bisa diantisioasi agar kejadiannitu tidak berulang terjadi? Kalau memang tdk bisa dicegah mengapa kilang di Indonesia saja sering terjadi?,@sukamtoeska @mrte9uh @islah_bahrawi kalau tahu akar penyebabnya itu mengapa tdk bisa diantisioasi agar kejadiannitu tidak berulang terjadi? kalau memang tdk bisa dicegah mengapa kilang di indonesia saja sering terjadi?,akar sebab tdk diantisioasi kejadiannitu ulang tdk cegah kilang indonesia
@_riverheaven Brarti Mentri yg kemaren ada maen dong dgn mereka yg minta duit bikin kilang,@_riverheaven brarti mentri yg kemaren ada maen dong dgn mereka yg minta duit bikin kilang,brarti tri yg kemaren maen dgn yg duit bikin kilang
Bahlil Selidiki Penyebab Kebakaran Kilang Pertamina di Dumai https://t.co/No4LYGx0ZZ,bahlil selidiki penyebab kebakaran kilang pertamina di dumai https://t.co/no4lygx0zz,bahlil selidik sebab bakar kilang pertamina dumai
Bahlil Kirim Tim ke Dumai Imbas Kebakaran Kilang https://t.co/i7sOa8ZBLf,bahlil kirim tim ke dumai imbas kebakaran kilang https://t.co/i7soa8zblf,bahlil kirim tim dumai imbas bakar kilang
@kompascom Ko kaya kilang dibakar yah ?,@kompascom ko kaya kilang dibakar yah ?,ko kaya kilang bakar yah
@SUARAKRISTEN1 @detikcom Kilang Dumai Pertamina memiliki kapasitas pengolahan minyak mentah sekitar 170.000 barel per hari berdasarkan data resmi.,@suarakristen1 @detikcom kilang dumai pertamina memiliki kapasitas pengolahan minyak mentah sekitar 170.000 barel per hari berdasarkan data resmi.,kilang dumai pertamina milik kapasitas olah minyak mentah barel dasar data resmi
@Tan_Mar3M @susipudjiastuti Kalau @pertamina konsisten membangun kilang maka impor pasti turun drastis dan .. ada pihakÂ² yg aliran ke pundiÂ²nya hilang. Tidak bisa dipungkiri sudah terbongkar korupsi yang maha besar dari bisnis ini.,@tan_mar3m @susipudjiastuti kalau @pertamina konsisten membangun kilang maka impor pasti turun drastis dan .. ada pihakÂ² yg aliran ke pundiÂ²nya hilang. tidak bisa dipungkiri sudah terbongkar korupsi yang maha besar dari bisnis ini.,konsisten bangun kilang impor turun drastis pihak yg alir pundi nya hilang dipungkiri bongkar korupsi maha bisnis
@detikcom Berapa barel per hari dihasilkan oleh kilang minyak ini @grok?,@detikcom berapa barel per hari dihasilkan oleh kilang minyak ini @grok?,barel hasil kilang minyak
*Bakar Semangat Bukan Bakar Kilang Minyak: Melawan Gurita Mafia Migas yang Semakin Merajalela* Oleh: Andre Vincent Wenas https://t.co/5PhnCnE4of,*bakar semangat bukan bakar kilang minyak: melawan gurita mafia migas yang semakin merajalela* oleh: andre vincent wenas https://t.co/5phncne4of,bakar semangat bakar kilang minyak lawan gurita mafia migas rajalela andre vincent wenas
Bahlil Balas Tudingan Purbaya Soal Pertamina Malas Bangun Kilang https://t.co/xVHSl9xLWg,bahlil balas tudingan purbaya soal pertamina malas bangun kilang https://t.co/xvhsl9xlwg,bahlil balas tuding purbaya pertamina malas bangun kilang
@tanyakanrl Aku pake azarine ijo tosca yg 45spf dah pake 4 tahun ini. Ga bikin kulit kusam ga kilang minyak cepet meresapnyaa.,@tanyakanrl aku pake azarine ijo tosca yg 45spf dah pake 4 tahun ini. ga bikin kulit kusam ga kilang minyak cepet meresapnyaa.,pake azarine ijo tosca yg spf dah pake ga bikin kulit kusam ga kilang minyak cepet meresapnyaa
PERTAMINA DI KRITIK MENKEU PURBAYA SOAL KILANG MINYAK. ESOK HARI KILANG LANGSUNG TERBAKAR,pertamina di kritik menkeu purbaya soal kilang minyak. esok hari kilang langsung terbakar,pertamina kritik menkeu purbaya kilang minyak esok kilang langsung bakar
Pekerja Kilang Maut Motosikal Langgar Lori Keluar Simpang Di Jalan Gebeng berhampiran Stesen Minyak BHP https://t.co/GKf24166gO,pekerja kilang maut motosikal langgar lori keluar simpang di jalan gebeng berhampiran stesen minyak bhp https://t.co/gkf24166go,kerja kilang maut motosikal langgar lori simpang jalan gebeng hampir stesen minyak bhp
Remaja maut terperosok bawah bas kilang. Strim live di https://t.co/XMTbm9wVSI atau di aplikasi MYTV Mana-Mana Unifi TV dan Astro GO sekarang! #TVS122 #TVSNews #TVSarawak https://t.co/pg0JhfE5fE,remaja maut terperosok bawah bas kilang. strim live di https://t.co/xmtbm9wvsi atau di aplikasi mytv mana-mana unifi tv dan astro go sekarang! #tvs122 #tvsnews #tvsarawak https://t.co/pg0jhfe5fe,remaja maut perosok bas kilang strim live aplikasi mytv unifi tv astro go tvs tvsnews tvsarawak
@__AnakKolong @DPR_RI @KemensetnegRI @setkabgoid @KSPgoid @BocorAlusPol @NarasiNewsroom @mohmahfudmd Dengan 223 T bisa bangun 1 kilang.,@__anakkolong @dpr_ri @kemensetnegri @setkabgoid @kspgoid @bocoraluspol @narasinewsroom @mohmahfudmd dengan 223 t bisa bangun 1 kilang.,t bangun kilang
@tanyakanrl Aku pakai amaterasun yg biru tua nder. Udah setahunan kayaknya pakai itu Ringan ga sumuk ga bikin kulit tambah kayak kilang minyak,@tanyakanrl aku pakai amaterasun yg biru tua nder. udah setahunan kayaknya pakai itu ringan ga sumuk ga bikin kulit tambah kayak kilang minyak,pakai amaterasun yg biru tua nder udah tahun kayak pakai ringan ga sumuk ga bikin kulit kayak kilang minyak
@dhaintly Mmng perlu dicurigai ada unsur kesengajaan krn seringkali tjdi kebakaran kilang ktk ada desakan serius utk bangun kilang minyak apalgi sekarang dikatain males bangun kilang! Fraksi @Gerindra @PDI_Perjuangan boleh dicecar Dirut Pertamina knp seringkali tjdi kebakaran kilang???,@dhaintly mmng perlu dicurigai ada unsur kesengajaan krn seringkali tjdi kebakaran kilang ktk ada desakan serius utk bangun kilang minyak apalgi sekarang dikatain males bangun kilang! fraksi @gerindra @pdi_perjuangan boleh dicecar dirut pertamina knp seringkali tjdi kebakaran kilang???,mmng curiga unsur sengaja krn seringkali tjdi bakar kilang ktk desa serius utk bangun kilang minyak apalgi dikatain males bangun kilang fraksi cecar dirut pertamina knp seringkali tjdi bakar kilang
@dhaintly Kalau benar kilang sengaja dibakar agar terus bisa impor maka itu sudah tindak kriminal. Tapi kalau kebakaran bukan disengaja dengan banyaknya kilang yang terbakar maka patut diduga Pertamina tidak punya kemampuan memelihara kilang. Pdhl tenaga ahlinya banyak.,@dhaintly kalau benar kilang sengaja dibakar agar terus bisa impor maka itu sudah tindak kriminal. tapi kalau kebakaran bukan disengaja dengan banyaknya kilang yang terbakar maka patut diduga pertamina tidak punya kemampuan memelihara kilang. pdhl tenaga ahlinya banyak.,kilang sengaja bakar impor tindak kriminal bakar sengaja banyak kilang bakar patut duga pertamina mampu pelihara kilang pdhl tenaga ahli
@pertamina fee impor udh cair min?? wkwkw btw kira berapa kilang lg yg mau dibakar min??,@pertamina fee impor udh cair min?? wkwkw btw kira berapa kilang lg yg mau dibakar min??,fee impor udh cair min wkwkw btw kilang lg yg bakar min
@liputan6dotcom Knp gk nyuruh Pertamina bae yg suruh bangun kilang minyak sebanyak2nya gt kalo kilang cukup banyak ntr tinggal disewain ke mereka...,@liputan6dotcom knp gk nyuruh pertamina bae yg suruh bangun kilang minyak sebanyak2nya gt kalo kilang cukup banyak ntr tinggal disewain ke mereka...,knp gk nyuruh pertamina bae yg suruh bangun kilang minyak nya gt kalo kilang ntr tinggal disewain
Ketika Purbaya Geram Soal Danantara hingga Kilang Pertamina https://t.co/5sbFoxNg49,ketika purbaya geram soal danantara hingga kilang pertamina https://t.co/5sbfoxng49,purbaya geram danantara kilang pertamina
@Mdy_Asmara1701 Bikin kilang itu nggak segampang bangun ruko bro. Investasinya bisa belasan miliar dolar dan butuh waktu 5 7 tahun sampai jadi. Pertamina malah lagi jalanin proyek besar kayak RDMP dan GRR buat naikin kapasitas kilang dalam negeri.,@mdy_asmara1701 bikin kilang itu nggak segampang bangun ruko bro. investasinya bisa belasan miliar dolar dan butuh waktu 5 7 tahun sampai jadi. pertamina malah lagi jalanin proyek besar kayak rdmp dan grr buat naikin kapasitas kilang dalam negeri.,bikin kilang gampang bangun ruko bro investasi bas miliar dolar butuh pertamina jalanin proyek kayak rdmp grr naikin kapasitas kilang negeri
@Metro_TV Kirain SPBU swasta punya Kilang dan pengolahan sendiri?,@metro_tv kirain spbu swasta punya kilang dan pengolahan sendiri?,kirain spbu swasta kilang olah
@InfoJktCom Gaspol terus upgrade kilang,@infojktcom gaspol terus upgrade kilang,gaspol upgrade kilang
Bakar Semangat Bukan Bakar Kilang Minyak: Melawan Gurita Mafia Migas yang Semakin Merajalela Oleh: Andre Vincent Wenas https://t.co/fuFLIklwqX,bakar semangat bukan bakar kilang minyak: melawan gurita mafia migas yang semakin merajalela oleh: andre vincent wenas https://t.co/fufliklwqx,bakar semangat bakar kilang minyak lawan gurita mafia migas rajalela andre vincent wenas
@Loveinloveyz @salam4jari @RoyJp69 Bagus sih tapi kok malah nyuruh beli kilang dari cina lageee cina lage ..,@loveinloveyz @salam4jari @royjp69 bagus sih tapi kok malah nyuruh beli kilang dari cina lageee cina lage ..,bagus sih nyuruh beli kilang cina lage cina lage
@NasbiHasan Baru jd komisaris beberapa hari satu kilang minyak terbakar apakah ini berarti petanda ? Hanya Penjilat yg tau,@nasbihasan baru jd komisaris beberapa hari satu kilang minyak terbakar apakah ini berarti petanda ? hanya penjilat yg tau,jd komisaris kilang minyak bakar tanda jilat yg tau
