full_text,case_folding CPMK2,preprocessing CPMK3
@MukaniRudi8970 Makanya Pertamina malas bangun KILANG. Biar impor terus dan cuan terus. Penikmatnya para mafia. Negara penghasil minyak. Minyaknya di ekspor ke Singapura kemudian di impor lagi. Rusak !,@mukanirudi8970 makanya pertamina malas bangun kilang. biar impor terus dan cuan terus. penikmatnya para mafia. negara penghasil minyak. minyaknya di ekspor ke singapura kemudian di impor lagi. rusak !,pertamina malas bangun kilang biar impor cuan nikmat mafia negara hasil minyak minyak ekspor singapura impor rusak
Tragis banget. Ternyata pertamina setiap tahunnya bakar-bakar kilang. Apa yg sedang mereka masak? Tentunya tetangga rumah hanya bisa mencium baunya aja https://t.co/CMCcODo2c9,tragis banget. ternyata pertamina setiap tahunnya bakar-bakar kilang. apa yg sedang mereka masak? tentunya tetangga rumah hanya bisa mencium baunya aja https://t.co/cmccodo2c9,tragis banget pertamina tahun bakar bakar kilang yg masak tetangga rumah cium bau aja
@jackcfrost Proyek kilang kasi or asing agar kita bisa bagi2,@jackcfrost proyek kilang kasi or asing agar kita bisa bagi2,proyek kilang kasi or asing
2 Hari 2 Kilang Minyak Besar Terbakar Hebat Ini 5 Faktanya https://t.co/aNNYNrJQdX,2 hari 2 kilang minyak besar terbakar hebat ini 5 faktanya https://t.co/annynrjqdx,kilang minyak bakar hebat fakta
@tham878 Purbaya lebih tahu krn ia dulu kerja di Migas dengan penduduk 280 juta sudah seharusnya Indonesia punya kilang dg kapasitas menengah atau hidupkan lagi kilang2 menganggur spt di Pangkalan Brandan Prabumulih dll.,@tham878 purbaya lebih tahu krn ia dulu kerja di migas dengan penduduk 280 juta sudah seharusnya indonesia punya kilang dg kapasitas menengah atau hidupkan lagi kilang2 menganggur spt di pangkalan brandan prabumulih dll.,purbaya krn kerja migas duduk juta indonesia kilang dg kapasitas tengah hidup kilang anggur spt pangkal brandan prabumulih
Breaking News: Api Melahap Kilang Minyak Chevron Terbesar di Pantai Barat AS https://t.co/3M0tzDdlYQ https://t.co/I4ECgRqspA,breaking news: api melahap kilang minyak chevron terbesar di pantai barat as https://t.co/3m0tzddlyq https://t.co/i4ecgrqspa,breaking news api lahap kilang minyak chevron besar pantai barat as
Pak Purbaya coba Usut kasus terkait rencana pembangunan Kilang minyak di Tuban yg digagas dan dimulai sejak tahun 2022 sampe skg Ga jelas. Ada Potensi kerugian negara sebesar 7 T tuh pak. @KemenkeuRI @PurbayaYudhi,pak purbaya coba usut kasus terkait rencana pembangunan kilang minyak di tuban yg digagas dan dimulai sejak tahun 2022 sampe skg ga jelas. ada potensi kerugian negara sebesar 7 t tuh pak. @kemenkeuri @purbayayudhi,purbaya coba usut kait rencana bangun kilang minyak tuban yg gagas sampe skg ga potensi rugi negara t tuh
@sharpandshark Buzer2 Purbaya .. pada tolol semua.. Pertamina i tu sedang bangun 6 kilang baru . Bener bener https://t.co/iJVfO5sMRP,@sharpandshark buzer2 purbaya .. pada tolol semua.. pertamina i tu sedang bangun 6 kilang baru . bener bener https://t.co/ijvfo5smrp,buzer purbaya tolol pertamina i tu bangun kilang bener bener
Di Indonesia gak perlu drone Lyutyi FP-1 atau drone jarak jauh lainnya. Cukup tahun anggaran baru satu atau dua kilang jadi debu.,di indonesia gak perlu drone lyutyi fp-1 atau drone jarak jauh lainnya. cukup tahun anggaran baru satu atau dua kilang jadi debu.,indonesia gak drone lyutyi fp drone jarak anggar kilang debu
base fuel dari kilang RU ini dikirim via kapal baru nyampur aditifnya di depo sebelum dikirim ke spbu. mungkin ya kl shell bisa smp ke daerah terpencil bisa aja casenya sama. shell ini rantai logistiknya pendek ngontrolnya gampang.,base fuel dari kilang ru ini dikirim via kapal baru nyampur aditifnya di depo sebelum dikirim ke spbu. mungkin ya kl shell bisa smp ke daerah terpencil bisa aja casenya sama. shell ini rantai logistiknya pendek ngontrolnya gampang.,base fuel kilang ru kirim via kapal nyampur aditif depo kirim spbu kl shell smp daerah pencil aja casenya shell rantai logistik pendek ngontrolnya gampang
Kilang lama terbakar. Purbaya: males-malesan utk bangun kilang baru. https://t.co/qzn0A2bhka,kilang lama terbakar. purbaya: males-malesan utk bangun kilang baru. https://t.co/qzn0a2bhka,kilang bakar purbaya males malesan utk bangun kilang
@oknumwarga @CFALEVEL99 Berdasarkan analisis dari berbagai sumber kebakaran berulang di kilang Pertamina sering disebabkan oleh kebocoran gas (misalnya hidrogen) luapan minyak sedimentasi sulfur serta faktor eksternal seperti petir. Faktor lain meliputi usia infrastruktur dan standar keselamatan.,@oknumwarga @cfalevel99 berdasarkan analisis dari berbagai sumber kebakaran berulang di kilang pertamina sering disebabkan oleh kebocoran gas (misalnya hidrogen) luapan minyak sedimentasi sulfur serta faktor eksternal seperti petir. faktor lain meliputi usia infrastruktur dan standar keselamatan.,dasar analisis sumber bakar ulang kilang pertamina sebab bocor gas hidrogen luap minyak sedimentasi sulfur faktor eksternal petir faktor liput usia infrastruktur standar selamat
@ambictious â € â € Sebenarnya lebih ke kilang anggur sih. Tapi ada kebunnya juga. Mungkin bisa tukeran kebun kapan-kapan? Hehe. â € â €,@ambictious â € â € sebenarnya lebih ke kilang anggur sih. tapi ada kebunnya juga. mungkin bisa tukeran kebun kapan-kapan? hehe. â € â €,kilang anggur sih kebun tukeran kebun hehe
Daftar 6 Kilang Milik Pertamina di Tengah Riuh Kritik Purbaya https://t.co/3uVwnZtHk6,daftar 6 kilang milik pertamina di tengah riuh kritik purbaya https://t.co/3uvwnzthk6,daftar kilang milik pertamina riuh kritik purbaya
Sentilan Menkeu Purbaya soal Malas-malasan Bangun Kilang Minyak Menteri ESDM Bahlil hingga Pertamina Buka Suara https://t.co/tip9gPJrqi,sentilan menkeu purbaya soal malas-malasan bangun kilang minyak menteri esdm bahlil hingga pertamina buka suara https://t.co/tip9gpjrqi,sentil menkeu purbaya malas malas bangun kilang minyak menteri esdm bahlil pertamina buka suara
@_akunkomen @somexthread MBG kilang minyak terbakar DPR dan kekonyolan mereka,@_akunkomen @somexthread mbg kilang minyak terbakar dpr dan kekonyolan mereka,mbg kilang minyak bakar dpr konyol
Politikus PDI Perjuangan Ferdinand Hutahaean menyentil Menteri Keuangan Purbaya Yudhi Sadewa usai menyebut Pertamina malas membangun kilang baru. Ferdinand meminta Purbaya tidak asal bicara dan tidak merasa paling hebat dibanding pejabat lain. Menurutnya pembangunan https://t.co/Nb7eTnD9QJ,politikus pdi perjuangan ferdinand hutahaean menyentil menteri keuangan purbaya yudhi sadewa usai menyebut pertamina malas membangun kilang baru. ferdinand meminta purbaya tidak asal bicara dan tidak merasa paling hebat dibanding pejabat lain. menurutnya pembangunan https://t.co/nb7etnd9qj,politikus pdi juang ferdinand hutahaean sentil menteri uang purbaya yudhi sadewa sebut pertamina malas bangun kilang ferdinand purbaya bicara hebat banding jabat turut bangun
Kilang 1.5 Tingkat Untuk Dijual Lokasi: Jalan Kebun Klang hanya 5 minit ke Lebuhraya Kesas Lokasi sangat strategik dan mudah akses * Jenis: Kilang Link 1.5 Tingkat * Pegangan Bebas (Freehold) Geran Individu * Unit Hujung (Corner Unit) * Saiz tanah bawah: 67 x 90 kaki,kilang 1.5 tingkat untuk dijual lokasi: jalan kebun klang hanya 5 minit ke lebuhraya kesas lokasi sangat strategik dan mudah akses * jenis: kilang link 1.5 tingkat * pegangan bebas (freehold) geran individu * unit hujung (corner unit) * saiz tanah bawah: 67 x 90 kaki,kilang tingkat jual lokasi jalan kebun klang minit lebuhraya kesas lokasi strategik mudah akses jenis kilang link tingkat pegang bebas freehold geran individu unit hujung corner unit saiz tanah x kaki
standar internasional. Sudahlah tidak usah klaim ini itu semua sdh tahu kok bagaimana pertamina bermain. Dari malas buat kilang hobi bakar2 sampai pengoplosan.,standar internasional. sudahlah tidak usah klaim ini itu semua sdh tahu kok bagaimana pertamina bermain. dari malas buat kilang hobi bakar2 sampai pengoplosan.,standar internasional klaim sdh pertamina main malas kilang hobi bakar oplos
Kalau memang benar terbakarnya kilang minyak di Dumai itu disengaja itu adalah ancaman untuk Pak Yudho. Ibarat kata.. semudah itu kilang dihilangkan apalagi keselamatan beliau..,kalau memang benar terbakarnya kilang minyak di dumai itu disengaja itu adalah ancaman untuk pak yudho. ibarat kata.. semudah itu kilang dihilangkan apalagi keselamatan beliau..,bakar kilang minyak dumai sengaja ancam yudho mudah kilang hilang selamat beliau
Kalau si Taek ikut tour ke US juga gue yakin dia sebenernya punya kilang minyak,kalau si taek ikut tour ke us juga gue yakin dia sebenernya punya kilang minyak,si taek tour us gue sebenernya kilang minyak
@profesor_saham Khusnudzon aja mungkin di tanggal itu ada petinggi kilang yg anaknya lagi aqiqah jadi mo bakar kambing,@profesor_saham khusnudzon aja mungkin di tanggal itu ada petinggi kilang yg anaknya lagi aqiqah jadi mo bakar kambing,khusnudzon aja tanggal petinggi kilang yg anak aqiqah mo bakar kambing
Wooy Sempak Merah apa korelasinya Pertamina bangun kilang minyak sama embargo AS terhadap Rusia ? Pembangunan kilang oleh Pertamina adalah bagian dari strategi ketahanan energi jangka panjang &amp; rencana ekspansi kapasitas bukan reaksi tunggal sanksi/embargo AS terhdp Rusia https://t.co/SVTqwCj1fl,wooy sempak merah apa korelasinya pertamina bangun kilang minyak sama embargo as terhadap rusia ? pembangunan kilang oleh pertamina adalah bagian dari strategi ketahanan energi jangka panjang &amp; rencana ekspansi kapasitas bukan reaksi tunggal sanksi/embargo as terhdp rusia https://t.co/svtqwcj1fl,wooy sempak merah korelasi pertamina bangun kilang minyak embargo as rusia bangun kilang pertamina strategi tahan energi jangka amp rencana ekspansi kapasitas reaksi tunggal sanksi embargo as terhdp rusia
Kebakaran Kilang Kembali Terjadi DPR: Pertamina Harus Berbenah! https://t.co/2d3ltnpQjv #DPR #Kilang #Pertamina #keselamatankerja #pengamanan #bitvonline,kebakaran kilang kembali terjadi dpr: pertamina harus berbenah! https://t.co/2d3ltnpqjv #dpr #kilang #pertamina #keselamatankerja #pengamanan #bitvonline,bakar kilang dpr pertamina benah dpr kilang pertamina keselamatankerja aman bitvonline
Keknya mau nutupin kasus pemadaman listrik yg di Aceh sudah berhari hari deh dan kilang minyak yg kebakar. Itu menurut saya aja sih,keknya mau nutupin kasus pemadaman listrik yg di aceh sudah berhari hari deh dan kilang minyak yg kebakar. itu menurut saya aja sih,kek nutupin madam listrik yg aceh hari deh kilang minyak yg bakar aja sih
@BloombergTZ alamat bakar kilang lagi kah?,@bloombergtz alamat bakar kilang lagi kah?,alamat bakar kilang
@jackcfrost Subsidi Energi Membengkak Menteri Keuangan Purbaya Desak Pertamina Bangun Kilang Baru https://t.co/gaveSPiSzU,@jackcfrost subsidi energi membengkak menteri keuangan purbaya desak pertamina bangun kilang baru https://t.co/gavespiszu,subsidi energi bengkak menteri uang purbaya desak pertamina bangun kilang
Jadi wajar kalau @KemenkeuRI @PurbayaYudhi bilang bukannya nambah kilang tapi malah dibakar ya kan @pertamina? Coba ini Pertaminanya diaudit dulu @Danantara_ri @danantaraIDN @bpkri dan bersihkan dari mafia migas di dalam cc @KPK_RI @KejaksaanRI Inget amanat pak @prabowo kan?,jadi wajar kalau @kemenkeuri @purbayayudhi bilang bukannya nambah kilang tapi malah dibakar ya kan @pertamina? coba ini pertaminanya diaudit dulu @danantara_ri @danantaraidn @bpkri dan bersihkan dari mafia migas di dalam cc @kpk_ri @kejaksaanri inget amanat pak @prabowo kan?,wajar bilang nambah kilang bakar coba pertaminanya audit sih mafia migas cc inget amanat
@taufik_q Kilang-kilabg di Singapura milik siapa? Jangan-jangan dia dia juga.... Coba tanya sama om Riza Chalid....,@taufik_q kilang-kilabg di singapura milik siapa? jangan-jangan dia dia juga.... coba tanya sama om riza chalid....,kilang kilabg singapura milik coba om riza chalid
Gak usah ribut2... Tinggal dirikan PT Indonesia Kilang yang terlepas dari @pertamina... Kalo gak ada uang cari investor pasti banyak yang mau... Gitu aja kok repot... @prabowo @SBYudhoyono @bang_dasco @puanmaharani_ri @aniesbaswedan @ganjarpranowo @mohmahfudmd https://t.co/sVaK3eZKZ2,gak usah ribut2... tinggal dirikan pt indonesia kilang yang terlepas dari @pertamina... kalo gak ada uang cari investor pasti banyak yang mau... gitu aja kok repot... @prabowo @sbyudhoyono @bang_dasco @puanmaharani_ri @aniesbaswedan @ganjarpranowo @mohmahfudmd https://t.co/svak3ezkz2,gak ribut tinggal diri pt indonesia kilang lepas kalo gak uang cari investor gitu aja repot
@profesor_saham Udah jelas purbaya ngomong 'dalam 5 tahun pertamina tidak satupun membangun 7 kilang yang dijanjikan malah ada yang dibakar' ingat ya guys 'dibakat' #nepalkan #patikan,@profesor_saham udah jelas purbaya ngomong 'dalam 5 tahun pertamina tidak satupun membangun 7 kilang yang dijanjikan malah ada yang dibakar' ingat ya guys 'dibakat' #nepalkan #patikan,udah purbaya ngomong pertamina satu bangun kilang janji bakar guys bakat nepalkan pati
Julukannya kota TAMAN salah satu kota terkaya di indonesia dgn jmlah pengangguran tinggi ada dua PT Raksasa. Yg satu punya kilang. Yg satu punya pupuk. Dlu punya ikon patung singapur yg terkenal ,julukannya kota taman salah satu kota terkaya di indonesia dgn jmlah pengangguran tinggi ada dua pt raksasa. yg satu punya kilang. yg satu punya pupuk. dlu punya ikon patung singapur yg terkenal ,juluk kota taman salah kota kaya indonesia dgn jmlah anggur pt raksasa yg kilang yg pupuk dlu ikon patung singapur yg kenal
@Ary_PrasKe2 @newIding30 @King_PWS_ @kenhans03 @hansifirdaus02 @GM_Warrios @Ganendra73 @FirzaHusain @dcristnugroho @Cintada16 Pertamina itu aslinya kaya-raya banget tapi sarang mafia dan kartel minyak Singapore gak ada kilang minyak dibangun untuk mengurangi kebutuhan impor semua habis dgn sengaja dibakar kualitas BBM yang dihasilkan pun sampah. Revolusi aja ini negara https://t.co/DT6AUNqM68,@ary_praske2 @newiding30 @king_pws_ @kenhans03 @hansifirdaus02 @gm_warrios @ganendra73 @firzahusain @dcristnugroho @cintada16 pertamina itu aslinya kaya-raya banget tapi sarang mafia dan kartel minyak singapore gak ada kilang minyak dibangun untuk mengurangi kebutuhan impor semua habis dgn sengaja dibakar kualitas bbm yang dihasilkan pun sampah. revolusi aja ini negara https://t.co/dt6aunqm68,pertamina asli kaya raya banget sarang mafia kartel minyak singapore gak kilang minyak bangun kurang butuh impor habis dgn sengaja bakar kualitas bbm hasil sampah revolusi aja negara
@profesor_saham 1 kilang isinya berapa liter kalau isinya dipindahkan sebelum terbakar dan dilaporkan terbakar kira2 berapa rupiah?,@profesor_saham 1 kilang isinya berapa liter kalau isinya dipindahkan sebelum terbakar dan dilaporkan terbakar kira2 berapa rupiah?,kilang isi liter isi pindah bakar lapor bakar rupiah
Gw udah difase percaya sengaja dipalsuin2 biar kasus yg gedeÂ² ketutup ini tiba2 kluar barang pas kilang kebakar mbg keracunan massal sama oplos etanol kok ya pas keluarin ijazah legisnya,gw udah difase percaya sengaja dipalsuin2 biar kasus yg gedeÂ² ketutup ini tiba2 kluar barang pas kilang kebakar mbg keracunan massal sama oplos etanol kok ya pas keluarin ijazah legisnya,gw udah fase percaya sengaja dipalsuin biar yg gede tutup kluar barang pas kilang bakar mbg racun massal oplos etanol pas keluarin ijazah legisnya
PALING2 BUAT NGILANGIN JEJAK OPLOSAN DI KILANG MINYAK,paling2 buat ngilangin jejak oplosan di kilang minyak,ngilangin jejak oplos kilang minyak
@iwankecil @sharpandshark Pertamina mendapatkan BBM RON 88 terutama dari produksi kilang dalam negeri seperti Cilacap dan Balongan serta impor dari Singapura dan Malaysia. Namun sejak 2023 RON 88 sedang difase out untuk beralih ke RON lebih tinggi seperti 90-92.,@iwankecil @sharpandshark pertamina mendapatkan bbm ron 88 terutama dari produksi kilang dalam negeri seperti cilacap dan balongan serta impor dari singapura dan malaysia. namun sejak 2023 ron 88 sedang difase out untuk beralih ke ron lebih tinggi seperti 90-92.,pertamina bbm ron produksi kilang negeri cilacap balong impor singapura malaysia ron fase out alih ron
@CNNIndonesia Bangun kilang malas tapi lihat temen temen yang kerja di Pertamina bonus nya aja bisa 10x gaji,@cnnindonesia bangun kilang malas tapi lihat temen temen yang kerja di pertamina bonus nya aja bisa 10x gaji,bangun kilang malas lihat temen temen kerja pertamina bonus nya aja x gaji
@tanyarlfes Nikah terus LDM itu gmn ya? Gw tau banyak yg gt cm kek org ga nikah anjir. Ini yg biasa nanya gini cewe kan ya jd mending lu ikut aja kecuali kerjaan suami lu di kilang minyak atau di Bulan mungkin ga bs ikut,@tanyarlfes nikah terus ldm itu gmn ya? gw tau banyak yg gt cm kek org ga nikah anjir. ini yg biasa nanya gini cewe kan ya jd mending lu ikut aja kecuali kerjaan suami lu di kilang minyak atau di bulan mungkin ga bs ikut,nikah ldm gmn gw tau yg gt cm kek org ga nikah anjir yg nanya gin cewe jd mending lu aja kerja suami lu kilang minyak ga bs
@daviddhikrory @roadrunners78 @islah_bahrawi Saya tidak tahu apakah lemparan issue pembakaran kilang ini bisa ditangkap polisi?? Bilang aja tidak takut jika itu mungkin,@daviddhikrory @roadrunners78 @islah_bahrawi saya tidak tahu apakah lemparan issue pembakaran kilang ini bisa ditangkap polisi?? bilang aja tidak takut jika itu mungkin,lempar issue bakar kilang tangkap polisi bilang aja takut
@daviddhikrory @roadrunners78 @islah_bahrawi Asal njeplak Apa huhungan koruptor dengan membakar kilang??,@daviddhikrory @roadrunners78 @islah_bahrawi asal njeplak apa huhungan koruptor dengan membakar kilang??,njeplak huhungan koruptor bakar kilang
Kebakaran di kilang penapisan Chevron Los Angeles berjaya dikawal https://t.co/6CNsPaDh9n https://t.co/FaghUqTbXZ,kebakaran di kilang penapisan chevron los angeles berjaya dikawal https://t.co/6cnspadh9n https://t.co/faghuqtbxz,bakar kilang tapis chevron los angeles jaya kawal
Kilang minyak,kilang minyak,kilang minyak
Ni Petromax jelek banget! Peeeengen bakar pom bensin cap Kuda Laut eh tapi mereka hobinya bakar kilang sendiri nggak ngefek dong?â€ï¸,ni petromax jelek banget! peeeengen bakar pom bensin cap kuda laut eh tapi mereka hobinya bakar kilang sendiri nggak ngefek dong?â€ï¸,ni petromax jelek banget ken bakar pom bensin cap kuda laut eh hobi bakar kilang ngefek
MUFTI dn Kerajaan puki maK .. betuL .. NABI S.A.W taK ajar pun sehingga MaLaysia boLeh buKa KILANG ARAK . https://t.co/UVHnRCiXPf,mufti dn kerajaan puki mak .. betul .. nabi s.a.w tak ajar pun sehingga malaysia boleh buka kilang arak . https://t.co/uvhnrcixpf,mufti dn raja puki mak nabi s a w ajar malaysia buka kilang arak
@Aerio_Id Pengen bakar pertamina tapi mereka hobinya bakar kilang sendiri nggak ngefek.,@aerio_id pengen bakar pertamina tapi mereka hobinya bakar kilang sendiri nggak ngefek.,ken bakar pertamina hobi bakar kilang ngefek
@userxmlf Kalau gak malas harusnya Pertamina sdh bisa bangun 10 kilang minyak(jadi kita TDK perlu impor BBM ke Singapura) subsidi bisa lebih kecil.,@userxmlf kalau gak malas harusnya pertamina sdh bisa bangun 10 kilang minyak(jadi kita tdk perlu impor bbm ke singapura) subsidi bisa lebih kecil.,gak malas pertamina sdh bangun kilang minyak tdk impor bbm singapura subsidi
@KucengTerbanggg Kabut asap air pasang banjir kilang minyak terbakar,@kucengterbanggg kabut asap air pasang banjir kilang minyak terbakar,kabut asap air pasang banjir kilang minyak bakar
@NephilaXmus Iya saya tau itu .... Itu hanya dalam skala laboratorium jadi masih bisa dikontrol Contoh sederhana kilang pertamina di plumpang. Dari tanah kosong sekarang jadi pemukiman padat yang nempel tembok kawasan kilang Jadi emang butuh treatment khusus menghadapi budaya masyarakat,@nephilaxmus iya saya tau itu .... itu hanya dalam skala laboratorium jadi masih bisa dikontrol contoh sederhana kilang pertamina di plumpang. dari tanah kosong sekarang jadi pemukiman padat yang nempel tembok kawasan kilang jadi emang butuh treatment khusus menghadapi budaya masyarakat,iya tau skala laboratorium kontrol contoh sederhana kilang pertamina plumpang tanah kosong mukim padat nempel tembok kawasan kilang emang butuh treatment khusus hadap budaya masyarakat
@Giiselje Indonesia baru berlaku dulu aku kerja kilang di Malaysia. Lebih jam kerja kira ot/ lembur.,@giiselje indonesia baru berlaku dulu aku kerja kilang di malaysia. lebih jam kerja kira ot/ lembur.,indonesia laku kerja kilang malaysia jam kerja ot lembur
Gue saking kebo nya tau ini pas ud pagi krn pada heboh ini kilang tebakar pdhal blum lama sih ini ada yg meledak.,gue saking kebo nya tau ini pas ud pagi krn pada heboh ini kilang tebakar pdhal blum lama sih ini ada yg meledak.,gue saking kebo nya tau pas ud pagi krn heboh kilang tebakar pdhal blum sih yg ledak
Sobat w Japanese yg jago bener englishnya either papinya wamenlu atau c level mufg atau punya kilang migas... Asia timur yg jago english biasanya anaknya orang . Taiwanese waktu itu papinya penulis progresif yg dicekal. Ogut orang jelata dengan bekron anak orang avg. ,sobat w japanese yg jago bener englishnya either papinya wamenlu atau c level mufg atau punya kilang migas... asia timur yg jago english biasanya anaknya orang . taiwanese waktu itu papinya penulis progresif yg dicekal. ogut orang jelata dengan bekron anak orang avg. ,sobat w japanese yg jago bener englishnya either papi wamenlu c level mufg kilang migas asia timur yg jago english anak orang taiwanese papi tulis progresif yg cekal ogut orang jelata bekron anak orang avg
@ajaha_lestaluhu @CNNIndonesia Itu jg di balikpapan bukan kilang baru tp nambah kilang dr yg udah ada....,@ajaha_lestaluhu @cnnindonesia itu jg di balikpapan bukan kilang baru tp nambah kilang dr yg udah ada....,jg balikpapan kilang tp nambah kilang dr yg udah
@hrdbacot Kayaknya udah desperate banget nih Pertamina setelah bbm-nya ga jadi dibeli swasta. Kira-kira kilang mana lagi ya yang bakal dibakar?,@hrdbacot kayaknya udah desperate banget nih pertamina setelah bbm-nya ga jadi dibeli swasta. kira-kira kilang mana lagi ya yang bakal dibakar?,kayak udah desperate banget nih pertamina bbm nya ga beli swasta kilang bakar
Pertamina Bantah Soal Tidak Bangun Kilang Minyak Ini Buktinya https://t.co/pFMdYVALvS,pertamina bantah soal tidak bangun kilang minyak ini buktinya https://t.co/pfmdyvalvs,pertamina bantah bangun kilang minyak bukti
@adarwis Ga sanggup 7 kilang.,@adarwis ga sanggup 7 kilang.,ga sanggup kilang
lama betulllll x bli kek Apollo haha even kilang depa dekat je https://t.co/w4bzFngWfx,lama betulllll x bli kek apollo haha even kilang depa dekat je https://t.co/w4bzfngwfx,x bli kek apollo haha even kilang depa je
@ladifsaint Kilang di Bakar Astaghfirullah @ReutersAsia,@ladifsaint kilang di bakar astaghfirullah @reutersasia,kilang bakar astaghfirullah
Eh pentol korek apa korelasinya Pertamina bangun kilang minyak sama embargo AS terhadap Rusia ? Justru Pertamina harusnya bikin kilang sendiri supaya mereka bisa tackle permasalahan embargo AS gini nih kalo bohlam dikasih mulut. Banteng nggak nasionalis banget tai.,eh pentol korek apa korelasinya pertamina bangun kilang minyak sama embargo as terhadap rusia ? justru pertamina harusnya bikin kilang sendiri supaya mereka bisa tackle permasalahan embargo as gini nih kalo bohlam dikasih mulut. banteng nggak nasionalis banget tai.,eh pentol korek korelasi pertamina bangun kilang minyak embargo as rusia pertamina bikin kilang tackle masalah embargo as gin nih kalo bohlam kasih mulut banteng nasionalis banget tai
Pengalihan isu kilang yang dibakar ,pengalihan isu kilang yang dibakar ,alih isu kilang bakar
Warga Dumai Protes Soal Terbakarnya Kilang Minyak yang Terus Berulang 'Bahkan Memaki-maki Petugas Pertamina' https://t.co/umA6c6eZiI,warga dumai protes soal terbakarnya kilang minyak yang terus berulang 'bahkan memaki-maki petugas pertamina' https://t.co/uma6c6ezii,warga dumai protes bakar kilang minyak ulang maki maki tugas pertamina
@Opposite6888 Ketika ada isu Pertamax turbo Ron 91 ga lama ada kilang terbakar. Apakah isu Pertamax turbo Ron 91 itu benar sehingga kilang produksinya dibakar utk menghilangkan jejak. Masih teka teki tapi kaitannya masih masuk logika.,@opposite6888 ketika ada isu pertamax turbo ron 91 ga lama ada kilang terbakar. apakah isu pertamax turbo ron 91 itu benar sehingga kilang produksinya dibakar utk menghilangkan jejak. masih teka teki tapi kaitannya masih masuk logika.,isu pertamax turbo ron ga kilang bakar isu pertamax turbo ron kilang produksi bakar utk hilang jejak teka teki kait masuk logika
@GabrielleNass01 @userxmlf @pertamina @PDI_Perjuangan Berdasarkan pencarian terkini kebakaran kilang Pertamina di Dumai pada 1 Okt 2025 sedang diselidiki tanpa korban jiwa. Ada kritik bahwa Pertamina malas bangun kilang baru (dari Menkeu Purbaya) yang memicu respons keras dari PDIP seperti Ferdinand Hutahaean yang sebut,@gabriellenass01 @userxmlf @pertamina @pdi_perjuangan berdasarkan pencarian terkini kebakaran kilang pertamina di dumai pada 1 okt 2025 sedang diselidiki tanpa korban jiwa. ada kritik bahwa pertamina malas bangun kilang baru (dari menkeu purbaya) yang memicu respons keras dari pdip seperti ferdinand hutahaean yang sebut,dasar cari kini bakar kilang pertamina dumai okt selidik korban jiwa kritik pertamina malas bangun kilang menkeu purbaya picu respons keras pdip ferdinand hutahaean
@userxmlf Yang di serang itu @pertamina krn berbohong masalah kilang minyak dan dibakar kenapa @PDI_Perjuangan kebakaran jenggot ??! @grok bisakah kamu bantu analisa kenapa dan mengapa nya,@userxmlf yang di serang itu @pertamina krn berbohong masalah kilang minyak dan dibakar kenapa @pdi_perjuangan kebakaran jenggot ??! @grok bisakah kamu bantu analisa kenapa dan mengapa nya,serang krn bohong kilang minyak bakar bakar jenggot bantu analisa nya
